G85002,Streatham High Practice,"Streatham High Practice, 2-8 Gracefield Gardens, Streatham, London, SW16 2ST",020 30494850,13432,51.43257014038855,-0.1278673350850325,5
G85003,Belmont Hill Surgery,"The Surgery, 36 Belmont Hill, Lewisham, London, SE13 5AY",020 36750752,12404,51.46260466911242,-0.00444086694917,5
G85004,The Jenner Practice,"Jenner Health Centre, 201 Stanstead Road, Forest Hill, London, SE23 1HU",020 30492960,11116,51.44238749962568,-0.0411388455101056,4
G85005,South Lewisham Group Practice,"Sth Lewisham Grp Practice, 50 Conisborough Crescent, Catford, London, SE6 2SP",020 30492580,6307,51.43026897802703,-0.0130432639119207,3
G85006,The Acorn & Gaumont House Surgery,"153 Peckham High Street, Peckham, London, SE15 5SL",020 71387888,5016,51.47415626455097,-0.0666581243093002,2
G85011,Clapham Family Practice,"Mary Seacole Centre, 89 Clapham High Street, Clapham, London, SW4 7DB",020 30496600,4411,51.4629946,-0.1329797,2
G85013,Dr Rs Durston'S Practice,"Camberwell Green Surgery, 17 Camberwell Green, London, SE5 7AF",020 77033788,9915,51.47445776666667,-0.0927914333333333,4
G85014,Streatham Common Group Practice,"Streatham Common Grp Prac, St.Andrew'S Hall, Guildersfield Road, Streatham, London, SW16 5LS",020 30495470,11676,51.4164036405131,-0.1283959031082334,5
G85015,The Qrp Surgery,"The Queens Road P/Ship, 387 Queens Road, New Cross Gate, London, SE14 5HD",020 76352170,3555,51.47429045,-0.04696725,1
G85016,Herne Hill Group Practice,"Herne Hill Group Practice, 74 Herne Hill, East Brixton, London, SE24 9QP",020 72743314,7764,51.455609700000004,-0.0992508,3
G85019,Trafalgar Surgery,"Trafalgar Surgery, 10 Trafalgar Avenue, London, SE15 6NR",020 77039271,2236,51.485671936864904,-0.0744144607190541,1
G85020,Kingfisher Medical Centre,"Kingfisher Medical Centre, Staunton Street, Deptford, London, SE8 5DA",020 86927373,4246,51.48187610596034,-0.0305033110341662,2
G85021,Prentis Medical Centre,"The Surgery, 2 Prentis Road, Streatham, London, SW16 1XU",0844 4773313,10892,51.43048692619021,-0.130136580406686,4
G85022,North Wood Group Practice,"Crown Dale Medical Centre, 61 Crown Dale, Upper Norwood, London, SE19 3NY",020 86702414,2315,51.42341295,-0.0989967424501788,1
G85023,Lewisham Medical Centre,"Lewisham Medical Centre, 308 Lee High Road, Lewisham, London, SE13 5PJ",020 83180190,3132,51.45850701902602,0.0044759505205471,1
G85024,Sydenham Green Group Practice,"26 Holmshaw Close, Sydenham, London, SE26 4TH",020 30492820,3214,51.4291809818911,-0.0392150162828312,1
G85025,Brixton Hill Group Practice,"Brixton Hill Group Prac., 22 Raleigh Gardens, Brixton Hill, London, SW2 1AE",020 86746376,3395,51.452315290718786,-0.1202204966839163,1
G85026,Clifton Rise Family Practice,"Clifton Rise Family Pract, Waldron Hlth/Ctr(Suite 2), London, SE8 4BG",020 30493080,31308,51.47633424555389,-0.0314332699849823,5
G85027,Burnt Ash Surgery,"Lee Health Centre, 2 Handen Road, Lee, London, SE12 8NP",020 30492150,5079,51.45278217055989,0.0099126099580524,2
G85028,Stockwell Group Practice,"Stockwell Group Practice, 107 Stockwell Road, London, SW9 9TJ",020 72743225,14151,51.46803661748201,-0.117558731059585,5
G85029,Falmouth Road Group Practice,"Falmouth Road Group Pract, 78 Falmouth Road, Borough, London, SE1 4JW",020 74074101,30292,51.496427049451704,-0.0931223072017416,5
G85030,Parkside Medical Centre,"Parkside Medical Centre, 52 Camberwell Green, London, SE5 7AQ",020 77030596,11786,51.47582619150315,-0.0926423486267359,5
G85031,Dmc Chadwick Road,"Dmc Chadwick Road, 60 Chadwick Road, London, SE15 4PU",020 76399622,19119,51.46786393999507,-0.0742572405003687,5
G85032,Torridon Road Medical Practice,"Torridon Rd Med Practice, 80 Torridon Road, London, SE6 1RB",020 86985281,3523,51.440110094598026,-0.0021120288444829998,1
G85034,Nexus Health Group,"Princess Street GP Pract., 2 Princess Street, Elephant And Castle, London, SE1 6JP",020 79280253,2698,51.495617185234956,-0.1019585090378742,1
G85035,Morden Hill Surgery,"Morden Hill Surgery, 21-23 Morden Hill, Lewisham, London, SE13 7NN",020 84692880,3457,51.4691586,-0.013147,1
G85038,St Johns Medical Centre,"St Johns Medical Centre, 56-60 Loampit Hill, Lewisham, London, SE13 7SX",020 86921354,10158,51.4672864,-0.0221389499999999,4
G85039,Paxton Green Group Practice,"Paxton Green Grp Practice, Paxton Green Hth Centre, 1 Alleyn Park, London, SE21 8AU",020 86706878,8204,51.430297603900975,-0.0860944940271639,3
G85040,Queens Road Surgery,"136 Meeting House Lane,  London, SE15 2UA",020 76391133,18707,51.47518204590582,-0.0640325525506037,5
G85041,Palace Road Surgery,"1 Palace Road, Streatham Hill, London, SW2 3DY",020 86742032,10406,51.443796819309036,-0.1206278806129701,4
G85042,St Giles Surgery,"St.Giles Surgery, 40 St.Giles Road, Camberwell, London, SE5 7RF",020 72525145,13534,51.47454601463093,-0.0841709940052109,5
G85044,Valley Road Surgery,"Valley Road Surgery, 139 Valley Road, Streatham, London, SW16 2XT",020 87692566,10497,51.42858757984378,-0.1194286987018852,4
G85045,Hetherington Group Practice,"Hetherington Group Pract, 18 Hetherington Road, London, SW4 7NU",020 72744220,15563,51.46093246739429,-0.1282302709000705,5
G85046,Lee Road Surgery,"The Surgery, 20 Lee Road, Blackheath, East Lewisham, London, SE3 9RT",020 88521235,11418,51.46250282593601,0.0094183315193233,5
G85047,Knights Hill Surgery Suite 1,"Suite 1, West Norwood Health & Lc, West Norwood, London, SE27 0DF",020 31410700,10606,51.43179954109817,-0.1049211442563498,4
G85051,Elm Lodge Surgery,"Elm Lodge Surgery, 2 Burbage Road, Dulwich, London, SE24 9HJ",020 72746138,11520,51.45175737985242,-0.0953438551448385,5
G85052,Old Kent Road Surgery,"Old Kent Road Surgery, 182-184 Old Kent Road, London, SE1 5TY",020 72526272,19546,51.49041720753856,-0.08109302931252703,5
G85053,Hurley And Riverside Practices,"Ebenezer House, Kennington Lane, London, SE11 4HJ",020 77357918,8832,51.490667707632745,-0.1067448661670374,4
G85054,Lambeth Walk Group Practice,"Lambeth Walk Group Prac., 5 Lambeth Walk, London, SE11 6SP",020 77354412,4808,51.4957056926552,-0.1123770414846034,2
G85055,Hilly Fields Medical Centre,"Hilly Fields Medical Ctr., 172 Adelaide Avenue, Brockley, London, SE4 1JN",020 83145552,10586,51.45680313293171,-0.0240113048123644,4
G85057,Downham Family Medical Practice,"Downham Family Med Pract, 7-9 Moorside Road, Downham, Kent, BR1 5EP",020 30492030,15417,51.4265805243442,0.0102940968801605,5
G85061,Woolstone Medical Centre,"Woolstone Medical Centre, Woolstone Road, Lewisham, London, SE23 2SG",020 86991062,8579,51.4389450140366,-0.0347253823668455,4
G85073,Vassall Medical Centre,"Vassall Medical Centre, 89 Vassall Road, London, SW9 6NA",020 77933100,8505,51.477613632387104,-0.1084434752974784,4
G85076,New Cross Centre (Hurley Group),"Suite 3, Waldron Health Centre, Amersham Vale, London, SE14 6LD",020 30492249,9350,51.47671793265806,-0.0317017005661363,4
G85083,Sandmere Practice,"Sandmere Practice, 10-14 Sandmere Road, Clapham, London, SW4 7QJ",020 72746366,8824,51.46259434868797,-0.1275576377557949,4
G85084,Penrose Surgery,"Penrose Surgery, 33 Penrose Street, Borough, London, SE17 3DW",07908 245139,4540,51.487447312293966,-0.0977893672865201,2
G85085,Grove Medical Centre,"Grove Medical Centre, Windlass Place, Off Grove Street, Deptford, London, SE8 3QH",020 86921882,2716,51.49024083311907,-0.0353348322641028,1
G85086,The South Lambeth Rd Practice,"The South Lambeth Rd Prac, 1 Selway House, 272 South Lambeth Road, London, SW8 1UL",020 76221923,10,51.47656967361554,-0.1236732665099955,1
G85087,Silverlock Medical Centre,"Silverlock Medical Centre, 2 Verney Way, London, SE16 3HA",020 72374091,16598,51.48596663887221,-0.06336891731029701,5
G85089,Honor Oak Group Practice,"Honor Oak Health Centre, 20 Turnham Road, Brockley, London, SE4 2LA",020 30492345,8216,51.45809734897109,-0.041114068895383,3
G85091,The Three Zero Six Medical Centre,"3-Zero-6 Medical Centre, 306 Lordship Lane, London, SE22 8LY",020 86934704,9521,51.45074117427869,-0.0764026961410635,4
G85096,The Vale Surgery,"The Vale Surgery, Streatham Vale, London, SW16 5SE",020 86797536,5023,51.41724574175753,-0.1366598148875992,2
G85100,Beckett House Practice,"Beckett House, Grantham Road, London, SW9 9DL",020 77387030,10137,51.469490477921546,-0.1235461646909154,4
G85102,The Vauxhall Surgery,"8 Jonathan Street, Kennington, London, SE11 5NH",020 77351971,14278,51.4898196,-0.11957910000000002,5
G85104,Ico Health Group,"Moorside Clinic, 7-9 Moorside Road, Bromley, Kent, BR1 5EP",020 36402090,7706,51.4265805243442,0.0102940968801605,3
G85105,Vesta Road Surgery,"Vesta Road Surgery, 58 Vesta Road, London, SE4 2NH",020 76390654,13057,51.46873684058422,-0.0406439941913901,5
G85109,Clapham Park Group Practice,"Clapham Park Grp Practice, 72 Clarence Avenue, London, SW4 8JP",020 86785420,5652,51.45190761140197,-0.1352344593063364,2
G85114,Wells Park Practice,"Wells Park Practice, 1 Wells Park Road, Sydenham, London, SE26 6JQ",020 86992840,8694,51.43050813606914,-0.0633269010657624,4
G85119,Sternhall Lane Surgery,"Sternhall Lane Surgery, 12 Sternhall Lane, Peckham, London, SE15 4NT",020 76393553,7976,51.46677149390579,-0.0674356255891307,3
G85120,Triangle Group Practice,"Triangle Group Practice, 2 Morley Road, East Lewisham, London, SE13 6DQ",020 83187272,8397,51.457946899999996,-0.0116534,4
G85121,Parkview Surgery,"Parkview Surgery, 186 Brownhill Road, Catford, London, SE6 1AT",020 86986566,12848,51.444864016390646,-0.0077327849302437,5
G85123,Binfield Road Surgery,"Binfield Road Surgery, 1 Binfield Road, Kennington, London, SW4 6TB",020 76221424,9921,51.474463,-0.1254355,4
G85124,Bellingham Green Surgery,"The Bellingham Green Surg, 24 Bellingham Green, Catford, London, SE6 3JB",020 86977285,15130,51.4304987,-0.0240287,5
G85125,Park Medical Centre,"Park Medical Centre, 57 Hawkstone Road, London, SE16 2PE",020 72322243,8581,51.49240242137026,-0.0496269251016914,4
G85127,The Corner Surgery,"The Corner Surgery, 99 Coldharbour Lane, East Brixton, London, SE5 9NS",020 72744507,6017,51.469770539861756,-0.0955692667646297,3
G85129,The Deerbrook Surgery,"The Deerbrook Surgery, 216 Norwood Road, London, SE27 9AW",020 30496370,10724,51.43810856,-0.10607256,4
G85130,Mawbey Group Practice,"Mawbey Brough Hlth Ctre, 39 Wilcox Close, London, SW8 2UD",020 74115720,13556,51.4792833933115,-0.1252324521230085,5
G85132,Tessa Jowell GP Surgery,"Tessa Jowell Health Ctr, 72H East Dulwich Grove, London, SE22 8EY",020 81947600,11715,51.45912796364674,-0.0800375320830218,5
G85134,The Lister Primary Care Centre,"Lister Primary Care Ctre, 101 Peckham Road, London, SE15 5LJ",020 30498390,7164,51.47443583882089,-0.0752476685464075,3
G85135,Minet Green Health Practice,"Akerman Health Centre, 60 Patmos Road, London, SW9 6AF",020 30496690,4939,51.47571512303318,-0.105204019883515,2
G85136,Waterloo Health Centre,"Waterloo Health Centre, 5 Lower Marsh, Waterloo, London, SE1 7RJ",020 79284049,14519,51.50032207151183,-0.1134688264322242,5
G85137,Brockwell Park Surgery,"Brockwell Park Surgery, 117 Norwood Road, Norwood, London, SE24 9AE",020 86785400,5885,51.44878591677718,-0.1015410199643796,2
G85138,Albion Street Group Practice,"The Albion Street Hth Ctr, 87 Albion Street, Rotherhithe, London, SE16 7JX",020 30497148,5132,51.50100727879833,-0.0506427623261968,2
G85623,Bermondsey Spa Medical Centre,"Eyot House, 50 Old Jamaica Road, London, SE16 4BL",020 34746000,7568,51.49700605489632,-0.0691536742573191,3
G85632,The Villa Street Medical Centre,"The Villa Street Med Ctr, 47 Villa Street, London, SE17 2EL",020 77037393,9751,51.48657239999999,-0.08825210000000001,4
G85633,Novum Health Partnership,"The Primary Care Centre, Hawstead Road, Lewisham, London, SE6 4JH",020 71387150,9082,51.4495854,-0.018182499999999997,4
G85642,Blackfriars Medical Practice,"Blackfriars Medical Pract, 45 Colombo Street, London, SE1 8EE",020 79286216,7841,51.505363894326436,-0.1057755287748906,3
G85644,The Gardens Surgery,"The Surgery, The Gardens, London, SE22 9QU",020 86934715,2559,51.4606231906106,-0.0669165705108296,1
G85647,The Exchange Surgery,"The Exchange Surgery, 2-8 Gracefield Gardens, Streatham, London, SW16 2ST",020 30494888,9887,51.43257014038855,-0.1278673350850325,4
G85651,The Dulwich Medical Centre,"The Dulwich Medical Ctr, 163-169 Crystal Palace Rd, East Dulwich, London, SE22 9EP",020 86932727,5793,51.45523420558922,-0.0716087034344654,2
G85662,The Streatham Hill Group Practice,"Streatham Hill Group Prac, 6 Leigham Court Road, London, SW16 2PG",020 30495120,9484,51.437315685416145,-0.12640457168865,4
G85673,Springfield Medical Centre,"Springfield Medical Ctr, 110 Union Road, Stockwell, London, SW8 2SH",020 30494600,3571,51.47082507151704,-0.1333544995728576,1
G85674,Grafton Square Surgery,"8B Grafton Square, Clapham, London, SW4 0DE",020 76225642,4646,51.464144075,-0.1397904815300407,2
G85681,The Lordship Lane Surgery,"The Lordship Lane Surgery, 417 Lordship Lane, East Dulwich, London, SE22 8JN",020 86932912,1661,51.44869705410506,-0.0735822831615922,1
G85685,The Nunhead Surgery,"The Nunhead Surgery, 58 Nunhead Grove, Nunhead, London, SE15 3LY",020 76392715,2398,51.46408775128619,-0.0579464286278966,1
G85690,Herne Hill Road Medical Practice,"Herne Hill Road Med Pract, 1-3 Herne Hill Road, London, SE24 0AU",020 77379393,11470,51.465549064267734,-0.1004854240783457,5
G85695,Akerman Medical Practice,"Akerman Health Centre, 60 Patmos Road, London, SW9 6AF",020 30496500,12450,51.47571512303318,-0.105204019883515,5
G85696,Vale Medical Centre,"The Vale Medical Centre, 195-197 Perry Vale, Forest Hill, London, SE23 2JF",020 82917007,8405,51.43546908048258,-0.0436505392723855,4
G85698,Amersham Vale Training Practice,"Suite 5 Waldron Hlth Ctr, Amersham Vale, New Cross, London, SE14 6LD",020 30493600,9320,51.47671793265806,-0.0317017005661363,4
G85705,The New Mill Street Surgery,"New Mill Street Surgery, 1 Wolseley Street, London, SE1 2BP",0207 2521817,12374,51.50070779330196,-0.0711440406056817,5
G85706,The Old Dairy Health Centre,"The Old Dairy Health Ctr, 19B Croxted Road, West Dulwich, London, SE21 8SZ",020 87618070,8800,51.436181,-0.09072310000000001,4
G85708,Dr Curran & Partners,"Clapham Manor Health Ctr., 86 Clapham Manor Street, Clapham, London, SW4 6EB",020 74116866,6772,51.465148416964595,-0.1360336315587164,3
G85711,Deptford Surgery,"Deptford Surgery, 502-504 New Cross Road, Deptford, London, SE14 6TJ",020 86941331,8640,51.474912694999894,-0.027273170468731,4
G85715,The Lister Practice,"101 Peckham Road,  London, SE15 5LJ",020 34745570,34975,51.47443583882089,-0.0752476685464075,5
G85716,Oakview Family Practice,"Oakview Family Practice, 190 Shroffold Road, Downham, Bromley, Kent, BR1 5NJ",020 86956677,11143,51.42982819287422,0.0070204869363839,4
G85721,301 East Street Surgery,"301 East Street, Walworth, London, SE17 2SX",020 77034550,11299,51.490129093392895,-0.0824518344613936,4
G85722,Woodlands Health Centre,"Woodlands Health Centre, 4 Edwin Hall Place, London, SE13 6RN",020 86986664,15039,51.449858390919246,-0.0058170801781972,5
G85724,Edith Cavell Practice,"At Medics, 41 A-C Streatham Hill, London, SW2 4TP",020 30495900,6127,51.44126184118232,-0.1246170799548901,3
G85726,St Giles Surgery Dr Patel,"St.Giles Surgery, 40 St.Giles Road, Camberwell, London, SE5 7RF",020 72525145,13052,51.47454601463093,-0.0841709940052109,5
G85727,Nightingale Surgery,"Nightingale Surgery, Lee Hlth Ctr, 2 Handen Rd, London, SE12 8NP",020 30492180,9977,51.45278217055989,0.0099126099580524,4
G85736,Deptford Medical Centre,"Deptford Medical Centre, 2 Pearson'S Avenue, New Cross, London, SE14 6TG",020 86920033,6232,51.474534644128724,-0.0270899387018858,3
H83001,Portland Medical Centre,"Portland Medical Centre, 184 Portland Road, South Norwood, London, SE25 4QB",020 86621233,28216,51.39312716872082,-0.0670762207973363,5
H83004,The Farley Road Medical Practice,"53 Farley Road, Selsdon, South Croydon, Surrey, CR2 7NG",020 86511222,17265,51.34580368872203,-0.0664980469098277,5
H83005,Upper Norwood Group Practice,"Chaucer House, 130 Church Road, Upper Norwood, London, SE19 2NT",020 87716050,10076,51.4133075602248,-0.08481962506235,4
H83006,New Addington Group Practice,"Parkway Health Centre, Parkway, New Addington, Croydon, Surrey, CR0 0JA",01689 808810,6106,51.34339470000001,-0.018263400000000003,3
H83007,Violet Lane Medical Practice,"Violet Lane Med/Practice, 231 Violet Lane, Croydon, Surrey, CR0 4HN",020 86880333,6595,51.360365806349286,-0.1079715770033417,3
H83008,The Addiscombe Surgery,"395A Addiscombe Road, Croydon, Surrey, CR0 7LJ",020 86542200,7572,51.3764716,-0.0603943,3
H83009,Norbury Health Centre (02),"Norbury Health Centre, 2B Pollards Hill North, Norbury, London, SW16 4NL",020 86796591,11071,51.40450538291086,-0.12271363197087301,4
H83010,South Norwood Hill Medical Centre,"South Norwood Hill Med/Ct, 103A South Norwood Hill, London, SE25 6BY",020 87710742,4211,51.403169491997254,-0.0807717942361478,2
H83011,North Croydon Medical Centre,"North Croydon Medical Ctr, 518 London Road, Thornton Heath, Surrey, CR7 7HQ",0844 4773485,21785,51.387925872710106,-0.1110554701462526,5
H83012,St. James'S Medical Centre,"St.James'S Medical Centre, 189A St.James'S Road, Croydon, Surrey, CR0 2BZ",020 86845353,3758,51.38177661250001,-0.0929878874999999,1
H83013,Old Coulsdon Medical Practice,"Old Coulsdon Med Practice, 2A Court Avenue, Old Coulsdon, Surrey, CR5 1HF",01737 558288,7337,51.30677984,-0.11838348,3
H83014,Queenhill Medical Practice,"Queenhill Medical Prac, 31 Queenhill Road,Selsdon, South Croydon, Surrey, CR2 8DU",020 86511141,2983,51.344990173483716,-0.0667907543705364,1
H83015,Parkside Group Practice,"Parkside Group Practice, 27 Wyche Grove, South Croydon, Surrey, CR2 6EX",020 86802588,1961,51.350700700000004,-0.0979964,1
H83016,Keston Medical Practice,"Purley War Memorial Hosp, 856 Brighton Road, Purley, Surrey, CR8 2YL",020 86608292,4015,51.340451613757104,-0.1146478495952515,2
H83017,Brigstock & South Norwood Partnership,"141 Brigstock Road, Thornton Heath, Surrey, CR7 7JN",020 86840033,3144,51.395136444952726,-0.10882621487765301,1
H83018,Selsdon Park Medical Practice,"Selsdon Park Med.Practice, 97 Addington Rd, Selsdon, South Croydon, Surrey, CR2 8LG",020 86570067,29874,51.34240858227742,-0.064573311739737,5
H83019,Friends Road Medical Practice,"Friends Road Med/Pract, 49 Friends Road, Croydon, Surrey, CR0 1ED",020 86880532,9783,51.37112439999999,-0.0947884,4
H83020,Eversley Medical Centre,"Eversley Medical Centre, 501 London Road, Thornton Heath, Surrey, CR7 6AR",020 86841172,16748,51.38851369962178,-0.1119130716256086,5
H83021,London Road Medical Practice,"London Road Medical Pract, 515 London Road, Thornton Heath, Surrey, CR7 6AR",020 82399002,9104,51.38851369962178,-0.1119130716256086,4
H83022,Thornton Heath Health Centre,"Thornton Heath Health Ctr, 61A Gillett Road, Thornton Heath, Surrey, CR7 8RL",020 86641590,7356,51.39774503094076,-0.0960934205148494,3
H83023,Morland Road Surgery,"1 Morland Road, East Croydon, Surrey, CR0 6HA",020 86880434,8260,51.38197091534372,-0.0833544964033649,3
H83024,Woodcote Medical,"Woodcote Medical, 32 Foxley Lane, Purley, Surrey, CR8 3EE",020 87635620,4416,51.34121145,-0.12421555,2
H83028,Addington Medical Practice,"Parkway, New Addington, Croydon, Surrey, CR0 0JA",01689 849993,7114,51.34339470000001,-0.018263400000000003,3
H83029,Hartland Way Surgery,"1 Hartland Way, Shirley, Croydon, Surrey, CR0 8RG",020 87777215,7561,51.374371818939885,-0.0457821808356859,3
H83030,Broom Road Medical Practice,"23 Broom Road, Shirley, Croydon, Surrey, CR0 8NG",020 87775511,14604,51.369702933042404,-0.0302152704188462,5
H83031,The Haling Park Partnership,"96 Brighton Road, South Croydon, Surrey, CR2 6AD",020 86880875,8311,51.35711258128479,-0.0981089639511296,3
H83033,Ashburton Park Medical Centre,"Ashburton Park M.Practice, 416 Lower Addiscombe Road, Addiscombe, Surrey, CR0 7AG",020 37146868,7421,51.3835412,-0.0648266,3
H83034,The Whitehorse Practice,"The Whitehorse Practice, 87 Whitehorse Road, Croydon, Surrey, CR0 2JJ",020 86841162,56838,51.38668953502986,-0.0969428236997785,5
H83037,Auckland Surgery,"Auckland Surgery, 84A Auckland Road, Upper Norwood, London, SE19 2DF",020 86535146,7130,51.40952981464282,-0.0809224733626092,3
H83039,Stovell House Surgery,"188 Lower Addiscombe Road, Addiscombe, Croydon, Surrey, CR0 6AH",020 86541427,8506,51.37889952404404,-0.0753781845390474,4
H83040,Mitchley Avenue Surgery,"116 Mitchley Avenue, Sanderstead, South Croydon, Surrey, CR2 9HH",020 86576565,8425,51.32997980136498,-0.0924852420561589,4
H83042,Leander Road Surgery,"949 London Road, Thornton Heath, Surrey, CR7 6JE",020 34578727,6547,51.39945709651342,-0.1174573603995435,3
H83043,Shirley Medical Centre,"Shirley Medical Centre, 370 Wickham Rd,Shirley, Croydon, CR0 8BH",020 87772066,3808,51.37541869,-0.04375971,1
H83044,East Croydon Medical Centre,"Edridge Road Practice, Impact House,2 Eldrige Rd, Croydon, CR0 1FE",020 36574170,4813,51.375320327403784,-0.0874543734317567,2
H83049,Headley Drive Surgery,"117A Headley Drive, New Addington, Croydon, Surrey, CR0 0QL",0844 8151201,3796,51.353267673851,-0.0159457924185837,1
H83051,Thornton & Valley Park Surgery,"Thornton Road Surgery, 299 Thornton Road, Croydon, Surrey, CR0 3EW",020 82519470,2914,51.3880411,-0.12076680000000001,1
H83052,Bramley Avenue Surgery,"Bramley Avenue Surgery, 1B Bramley Avenue, Coulsdon, Surrey, CR5 2DR",020 86600193,7207,51.32326303999999,-0.141516,3
H83053,Parchmore Medical Centre,"Parchmore Medical Centre, 97 Parchmore Road, Thornton Heath, Surrey, CR7 8LY",020 82514200,8489,51.402561849651796,-0.1009577528886095,4
H83608,Brigstock Family Practice,"Brigstock Family Practice, 83 Brigstock Road, Thornton Heath, Surrey, CR7 7JH",020 86897800,6675,51.397290559698675,-0.1035588585227407,3
H83609,Mersham Medical Centre,"Mersham Medical Centre, 30 Norbury Road, Thornton Heath, Surrey, CR7 8JN",020 86531869,2721,51.40451575,-0.09692039999999999,1
H83611,Selhurst Medical Practice,"Selhurst Medical Practice, 27 Selhurst Road, South Norwood, London, SE25 5QA",020 86842010,4647,51.39001221290021,-0.0889690450427816,2
H83624,Fairview Medical Centre,"Fairview Medical Centre, 69 Fairview Road, Norbury, London, SW16 5PX",0208 7658525,3428,51.410790554292404,-0.1243543317214083,1
H83625,Broughton Corner Family Practice,"Broughton Corner Med Ctr, 87 Thornton Road, Thornton Heath, Surrey, CR7 6BH",020 86831277,4086,51.39078673206403,-0.1196099595369835,2
H83627,Birdhurst Medical Practice,"Birdhurst Med Practice, 1 Birdhurst Avenue, South Croydon, Surrey, CR2 7DX",020 86862070,12245,51.365278588771496,-0.0926134162422499,5
H83631,Greenside Medical Practice,"Greenside Surgery, 88 Greenside Road, Croydon, Surrey, CR0 3PN",020 82400072,3552,51.384774588473384,-0.1131448458061687,1
H84002,Park Road Surgery,"The Park Road Surgery, 37 Park Road, Teddington, Middlesex, TW11 0AU",020 89775481,15612,51.4236881,-0.334486,5
H84005,Parkshot Medical Richmond,"18 Parkshot, Richmond, Surrey, TW9 2RG",020 89484217,12209,51.46427265981597,-0.3024369592409394,5
H84006,Richmond Medical Group,"Sheen Lane Health Centre, 70 Sheen Lane, East Sheen, London, SW14 8LP",020 88763901,3365,51.46581312436835,-0.2671714221448442,1
H84007,The Acorn Group Practice,"The Acorn Group Practice, 29-35 Holly Road, Twickenham, Middlesex, TW1 4EA",020 88924519,14074,51.44669975,-0.32905555,5
H84010,Canbury Medical Centre,"Canbury Medical Centre, 1 Elm Road, Kingston-Upon-Thames, Surrey, KT2 6HR",020 85474270,9626,51.41427446271787,-0.2971056685156343,4
H84012,The York Medical Practice,"The York Medical Practice, St.John'S H/Ctr,Oak Lane, Twickenham, Middlesex, TW1 3PA",020 87440220,5965,51.44936900119361,-0.3256974703280055,3
H84014,Paradise Road Practice,"Paradise Road Surgery, 37 Paradise Road, Richmond Upon Thames, Surrey, TW9 1SA",020 89402423,13342,51.46015198400773,-0.3013928278143521,5
H84015,Brunswick Surgery,"Brunswick Surgery, Surbiton Hth Ctr,Ewell Rd, Surbiton, Surrey, KT6 6EZ",020 83907118,12220,51.39077035199356,-0.2995387693234589,5
H84016,The Groves Medical Centre,"The Groves Medical Centre, 171 Clarence Avenue, New Malden, Surrey, KT3 3TX",020 83366565,32823,51.4105115,-0.26138920000000004,5
H84017,Seymour House And Lock Road Surgery,"Seymour House Surgery, 154 Sheen Road, Richmond, Surrey, TW9 1UU",020 89402802,4341,51.46228995943721,-0.2945464461243511,2
H84018,Broad Lane Surgery,"71 Broad Lane, Hampton, Middlesex, TW12 3AX",020 89795406,9770,51.42287353306981,-0.3681471119843158,4
H84020,Fairhill Medical Practice,"Fairhill Medical Practice, 81 Kingston Hill, Kingston-Upon-Thames, Surrey, KT2 7PX",020 85461407,8473,51.41669517564546,-0.2832623399318436,4
H84023,Essex House Surgery,"Essex House, Station Road, Barnes, London, SW13 0LW",020 88761033,5461,51.47256680316677,-0.2473946207547456,2
H84025,Hook Surgery,"Hook Surg,Merritt Med Ctr, Merritt Gardens, Chessington, Surrey, KT9 2GY",020 83976361,4553,51.35862490166914,-0.3120646422022788,2
H84027,Churchill Medical Centre,"The Churchill Med Ctr, Clifton Road, Kingston-Upon-Thames, Surrey, KT2 6PG",020 37272230,35,51.41338840841792,-0.2882141891174357,1
H84030,Central Surgery,"Central Surgery, Surbiton Hth Ctr,Ewell Rd, Surbiton, Surrey, KT6 6EZ",020 83996622,4251,51.39077035199356,-0.2995387693234589,2
H84031,Jubilee Surgery,"Whitton Corner H&Scc, Percy Road, Whitton, Middlesex, TW2 6JL",020 34585400,2270,51.44507270290836,-0.361484742544475,1
H84032,Hampton Wick Surgery,"Hampton Wick Surgery, 26 Upper Teddington Road, Hampton Wick, Surrey, KT1 4DY",020 89772638,4124,51.415592442406854,-0.3130829086609112,2
H84033,St Albans Medical Centre,"212 Richmond Road, Kingston-Upon-Thames, Surrey, KT2 5HF",020 85460400,2886,51.4219498794008,-0.3024787091418233,1
H84034,The Orchard Practice,"Gosbury Hill Health Ctr., Orchard Gardens, Chessington, Surrey, KT9 1AG",020 83979494,6668,51.36911639421341,-0.3035425098341307,3
